{
  "schemaVersion": 3,
  "id": "prj_01J0000000000000000000000",
  "name": "最小项目",
  "revision": 1,
  "createdAt": "2026-10-29T10:00:00+08:00",
  "updatedAt": "2026-10-29T10:00:00+08:00",
  "appVersion": "1.0.0",
  "settings": {
    "ratio": "16:9",
    "resolution": "480P",
    "duration": 5
  },
  "characters": [],
  "outfits": [],
  "locations": [],
  "shots": [],
  "canvas": {
    "nodes": [],
    "edges": [],
    "viewport": { "x": 0, "y": 0, "zoom": 1 }
  },
  "assets": []
}
